{
  "id": "federal_fundraising",
  "card_type_id": "asset",
  "cost": 0,
  "deck_limit": 3,
  "faction_id": "nbn",
  "influence_cost": 2,
  "is_unique": false,
  "side_id": "corp",
  "stripped_text": "When your turn begins, you may look at the top 3 cards of R&D and arrange them in any order. Then, if this server is not protected by ice, you may draw 1 card.",
  "stripped_title": "Federal Fundraising",
  "subtypes": ["political", "ritzy"],
  "text": "When your turn begins, you may look at the top 3 cards of R&D and arrange them in any order. Then, if this server is not protected by ice, you may draw 1 card.",
  "title": "Federal Fundraising",
  "trash_cost": 2
}
