{
  "id": "lilypad",
  "card_type_id": "hardware",
  "cost": 4,
  "deck_limit": 3,
  "faction_id": "shaper",
  "influence_cost": 3,
  "is_unique": true,
  "side_id": "runner",
  "stripped_text": "+2 mu The first time each turn you install a program, you may draw 1 card. Limit 1 console per player.",
  "stripped_title": "LilyPAD",
  "subtypes": ["console"],
  "text": "+2[mu]\nThe first time each turn you install a program, you may draw 1 card.\nLimit 1 <strong>console</strong> per player.",
  "title": "LilyPAD"
}
