{
  "id": "b_1001",
  "card_type_id": "asset",
  "cost": 1,
  "deck_limit": 3,
  "faction_id": "neutral_corp",
  "influence_cost": 0,
  "is_unique": true,
  "side_id": "corp",
  "stripped_text": "Remove 1 tag: End the run. You cannot use this ability during a run on this server.",
  "stripped_title": "B-1001",
  "subtypes": ["bioroid", "enforcer"],
  "text": "<strong>Remove 1 tag:</strong> End the run. You cannot use this ability during a run on this server.",
  "title": "B-1001",
  "trash_cost": 3
}
