{
  "id": "balanced_coverage",
  "card_type_id": "asset",
  "cost": 1,
  "deck_limit": 3,
  "faction_id": "nbn",
  "influence_cost": 1,
  "is_unique": false,
  "side_id": "corp",
  "stripped_text": "When your turn begins, you may choose a card type to look at the top card of R&D. If that card has the chosen type, you may reveal it and gain 2 credits.",
  "stripped_title": "Balanced Coverage",
  "subtypes": ["seedy"],
  "text": "When your turn begins, you may choose a card type to look at the top card of R&D. If that card has the chosen type, you may reveal it and gain 2[credit].",
  "title": "Balanced Coverage",
  "trash_cost": 3
}
