{
  "id": "hannah_wheels_pilintra",
  "card_type_id": "resource",
  "cost": 2,
  "deck_limit": 3,
  "faction_id": "anarch",
  "influence_cost": 2,
  "is_unique": true,
  "side_id": "runner",
  "stripped_text": "click: Gain click. Run a remote server. When that run ends, if it was unsuccessful, take 1 tag. Use this ability only once per turn. click, trash: Gain click click. Remove 1 tag.",
  "stripped_title": "Hannah \"Wheels\" Pilintra",
  "subtypes": ["connection"],
  "text": "[click]<strong>:</strong> Gain [click]. Run a remote server. When that run ends, if it was unsuccessful, take 1 tag. Use this ability only once per turn.\n[click], [trash]<strong>:</strong> Gain [click][click]. Remove 1 tag.",
  "title": "Hannah \"Wheels\" Pilintra"
}
