{
  "card_type_id": "ice",
  "cost": 6,
  "deck_limit": 3,
  "faction_id": "neutral_corp",
  "id": "machicolation",
  "influence_cost": 0,
  "is_unique": false,
  "side_id": "corp",
  "strength": 4,
  "stripped_text": "Subroutine Trash 1 program. Subroutine Trash 1 program. Subroutine Trash 1 piece of hardware. Subroutine The Runner loses 3 credits, if able. End the run.",
  "stripped_title": "Machicolation",
  "subtypes": ["code_gate", "destroyer"],
  "text": "[subroutine] Trash 1 program.\n[subroutine] Trash 1 program.\n[subroutine] Trash 1 piece of hardware.\n[subroutine] The Runner loses 3[credit], if able. End the run.",
  "title": "Machicolation",
  "layout_id": "copy",
  "faces": [
    {
      "stripped_text": "Subroutine Trash 1 resource. Subroutine Trash 1 resource. Subroutine Do 1 net damage. Subroutine The Runner loses click, if able. End the run.",
      "subtypes": ["code_gate", "destroyer", "ap"],
      "text": "[subroutine] Trash 1 resource.\n[subroutine] Trash 1 resource.\n[subroutine] Do 1 net damage.\n[subroutine] The Runner loses [click], if able. End the run."
    }
  ]
}
