{
  "id": "a_teia_ip_recovery",
  "base_link": 0,
  "card_type_id": "corp_identity",
  "deck_limit": 1,
  "faction_id": "jinteki",
  "influence_limit": 15,
  "is_unique": false,
  "minimum_deck_size": 45,
  "side_id": "corp",
  "stripped_text": "Limit 2 remote servers. The first time each turn you install a card in the root of or protecting a remote server, you may install 1 card from HQ in the root of or protecting another remote server, ignoring all costs. You cannot score the second card this turn.",
  "stripped_title": "A Teia: IP Recovery",
  "subtypes": ["division"],
  "text": "Limit 2 remote servers.\nThe first time each turn you install a card in the root of or protecting a remote server, you may install 1 card from HQ in the root of or protecting another remote server, ignoring all costs. You cannot score the second card this turn.",
  "title": "A Teia: IP Recovery"
}
