{
  "card_type_id": "hardware",
  "cost": 1,
  "deck_limit": 3,
  "faction_id": "criminal",
  "id": "flip_switch",
  "influence_cost": 1,
  "is_unique": false,
  "side_id": "runner",
  "stripped_text": "You cannot use this hardware during the Corp's turn. trash: Jack out. trash: Remove 1 tag. Interrupt -> trash: Reduce the base trace strength of a trace to 0.",
  "stripped_title": "Flip Switch",
  "text": "You cannot use this hardware during the Corp's turn.\n[trash]<strong>:</strong> Jack out.\n[trash]<strong>:</strong> Remove 1 tag.\n[interrupt] â†’ [trash]<strong>:</strong> Reduce the base trace strength of a trace to 0.",
  "title": "Flip Switch"
}
