{
  "id": "wage_workers",
  "card_type_id": "asset",
  "cost": 2,
  "deck_limit": 3,
  "faction_id": "haas_bioroid",
  "influence_cost": 2,
  "is_unique": true,
  "side_id": "corp",
  "stripped_text": "Whenever you finish taking an action, if you have taken that action exactly 3 times this turn, gain click.",
  "stripped_title": "Wage Workers",
  "subtypes": ["bioroid", "clone", "industrial"],
  "text": "Whenever you finish taking an action, if you have taken that action exactly 3 times this turn, gain [click].",
  "title": "Wage Workers",
  "trash_cost": 4
}
