{
  "base_link": 0,
  "card_type_id": "runner_identity",
  "deck_limit": 1,
  "faction_id": "neutral_runner",
  "id": "nova_initiumia_catalyst_impetus",
  "influence_limit": null,
  "is_unique": false,
  "minimum_deck_size": 40,
  "side_id": "runner",
  "stripped_text": "Your deck cannot include more than 1 copy of any card.",
  "stripped_title": "Nova Initiumia: Catalyst & Impetus",
  "subtypes": ["digital", "natural"],
  "text": "Your deck cannot include more than 1 copy of any card.",
  "title": "Nova Initiumia: Catalyst & Impetus"
}
