{
  "id": "the_price",
  "card_type_id": "event",
  "cost": 1,
  "deck_limit": 3,
  "faction_id": "anarch",
  "influence_cost": 2,
  "is_unique": false,
  "side_id": "runner",
  "stripped_text": "Trash the top 4 cards of your stack. You may install 1 of those cards, paying 3 credits less.",
  "stripped_title": "The Price",
  "text": "Trash the top 4 cards of your stack. You may install 1 of those cards, paying 3[credit] less.",
  "title": "The Price"
}
