{
  "id": "bahia_bands",
  "card_type_id": "event",
  "cost": 2,
  "deck_limit": 3,
  "faction_id": "neutral_runner",
  "influence_cost": 1,
  "is_unique": false,
  "side_id": "runner",
  "stripped_text": "Run any server. If successful, resolve 2 of the following in any order:  Draw 2 cards.  Install 1 card from your grip, paying 1 credit less.  Remove 1 tag.  Place 4 credits on this event. You can spend hosted credits to pay trash costs for the remainder of this run.",
  "stripped_title": "Bahia Bands",
  "subtypes": ["run"],
  "text": "Run any server. If successful, resolve 2 of the following in any order:\n• Draw 2 cards.\n• Install 1 card from your grip, paying 1[credit] less.\n• Remove 1 tag.\n• Place 4[credit] on this event. You can spend hosted credits to pay trash costs for the remainder of this run.",
  "title": "Bahia Bands"
}
