{
  "id": "laser_pointer",
  "card_type_id": "program",
  "cost": 2,
  "deck_limit": 3,
  "faction_id": "criminal",
  "influence_cost": 3,
  "is_unique": false,
  "memory_cost": 1,
  "side_id": "runner",
  "stripped_text": "Whenever you encounter a piece of AP, destroyer, or observer ice, you may trash this program to bypass that ice.",
  "stripped_title": "Laser Pointer",
  "subtypes": ["weapon"],
  "text": "Whenever you encounter a piece of <strong>AP</strong>, <strong>destroyer</strong>, or <strong>observer</strong> ice, you may trash this program to bypass that ice.",
  "title": "Laser Pointer"
}
