{
  "id": "greasing_the_palm",
  "card_type_id": "operation",
  "cost": 3,
  "deck_limit": 3,
  "faction_id": "haas_bioroid",
  "influence_cost": 3,
  "is_unique": false,
  "side_id": "corp",
  "stripped_text": "Gain 5 credits. You may install 1 card from HQ. You may remove 1 tag to place 1 advancement counter on that card.",
  "stripped_title": "Greasing the Palm",
  "subtypes": ["transaction"],
  "text": "Gain 5[credit]. You may install 1 card from HQ. You may remove 1 tag to place 1 advancement counter on that card.",
  "title": "Greasing the Palm"
}
