{
  "attribution": "Designed by 2020 American Continental Champion Jason Ford",
  "id": "joy_ride",
  "card_type_id": "event",
  "cost": 2,
  "deck_limit": 3,
  "faction_id": "shaper",
  "influence_cost": 3,
  "is_unique": false,
  "side_id": "runner",
  "stripped_text": "Run R&D. If successful, draw 5 cards.",
  "stripped_title": "Joy Ride",
  "subtypes": ["run"],
  "text": "Run R&D. If successful, draw 5 cards.",
  "title": "Joy Ride"
}
