{
  "card_type_id": "asset",
  "cost": 2,
  "deck_limit": 3,
  "faction_id": "haas_bioroid",
  "id": "vaporframe_fabricator",
  "influence_cost": 3,
  "is_unique": false,
  "side_id": "corp",
  "stripped_text": "click: Install 1 card from HQ, ignoring all costs. Use this ability only once per turn. When the Runner trashes this asset, you may install 1 card from HQ, ignoring all costs. You cannot install that card in the root of this server.",
  "stripped_title": "Vaporframe Fabricator",
  "text": "<strong>[click]:</strong> Install 1 card from HQ, ignoring all costs. Use this ability only once per turn.\nWhen the Runner trashes this asset, you may install 1 card from HQ, ignoring all costs. You cannot install that card in the root of this server.",
  "title": "Vaporframe Fabricator",
  "trash_cost": 3
}
