{
  "id": "lago_paranoa_shelter",
  "card_type_id": "resource",
  "cost": 2,
  "deck_limit": 3,
  "faction_id": "anarch",
  "influence_cost": 2,
  "is_unique": true,
  "side_id": "runner",
  "stripped_text": "The first time each turn the Corp installs a card in the root of a server, you may trash the top card of your stack to draw 1 card.",
  "stripped_title": "Lago Paranoa Shelter",
  "subtypes": ["connection", "location"],
  "text": "The first time each turn the Corp installs a card in the root of a server, you may trash the top card of your stack to draw 1 card.",
  "title": "Lago Parano√° Shelter"
}
