{
  "id": "strike_fund",
  "card_type_id": "event",
  "cost": 1,
  "deck_limit": 3,
  "faction_id": "anarch",
  "influence_cost": 1,
  "is_unique": false,
  "side_id": "runner",
  "stripped_text": "Gain 4 credits. When this event is trashed from your grip or stack, you may gain 2 credits.",
  "stripped_title": "Strike Fund",
  "text": "Gain 4[credit].\nWhen this event is trashed from your grip or stack, you may gain 2[credit].",
  "title": "Strike Fund"
}
