{
  "card_type_id": "program",
  "cost": 6,
  "deck_limit": 3,
  "faction_id": "neutral_runner",
  "id": "sneakdoor_prime",
  "influence_cost": 0,
  "is_unique": false,
  "memory_cost": 2,
  "side_id": "runner",
  "stripped_text": "click,click: Make a run on a remote server. If successful, instead treat it as a successful run on a central server.",
  "stripped_title": "Sneakdoor Prime",
  "text": "[click],[click]: Make a run on a remote server. If successful, instead treat it as a successful run on a central server.",
  "title": "Sneakdoor Prime",
  "layout_id": "copy",
  "faces": [
    {
      "stripped_text": "click,click: Make a run on a central server. If successful, instead treat it as a successful run on a remote server.",
      "text": "[click],[click]: Make a run on a central server. If successful, instead treat it as a successful run on a remote server."
    }
  ]
}
