{
  "id": "mercury_chrome_libertador",
  "base_link": 0,
  "card_type_id": "runner_identity",
  "deck_limit": 1,
  "faction_id": "criminal",
  "influence_limit": 15,
  "is_unique": false,
  "minimum_deck_size": 45,
  "side_id": "runner",
  "stripped_text": "Whenever you breach HQ or R&D during a run, if you did not break any subroutines during that run, you may access 1 additional card. Use this ability only once per turn.",
  "stripped_title": "Mercury: Chrome Libertador",
  "subtypes": ["bioroid"],
  "text": "Whenever you breach HQ or R&D during a run, if you did not break any subroutines during that run, you may access 1 additional card. Use this ability only once per turn.",
  "title": "Mercury: Chrome Libertador"
}
